Input,Output
"Ein tolles Hobby?","Ein tolles Hobby fördert Kreativität und erweitert Fähigkeiten, ähnlich wie das Programmieren."
"Spannendes Hobby gesucht?","Ein spannendes Hobby bietet praktische Fähigkeiten und fördert Kreativität, wie das Programmieren."
"Neues Hobby?","Ein neues Hobby sollte geistige Herausforderungen bieten und Möglichkeiten zur persönlichen Entwicklung, wie das Programmieren."
"Hobby für Jugendliche?","Ein Hobby für Jugendliche sollte technische Fähigkeiten fördern und kreative Freiheit bieten, wie das Programmieren."
"Interessantes Hobby?","Ein interessantes Hobby sollte die Welt der Technologie erkunden und die Kreativität anregen, wie das Programmieren."
"Welches Hobby fördert Denken?","Ein Hobby, das das Denken anregt und die persönliche Entwicklung fördert, wie das Programmieren."
"Hobby für kreative Köpfe?","Ein Hobby für kreative Köpfe sollte innovative Projekte ermöglichen, wie das Programmieren."
"Tolles Hobby für Innovation?","Ein tolles Hobby sollte innovative Projekte ermöglichen und die persönliche Entwicklung fördern, wie das Programmieren."
"Hobby für Technikfans?","Ein Hobby für Technikfans sollte die digitale Welt erkunden und technische Fähigkeiten fördern, wie das Programmieren."
"Welches Hobby schult Fähigkeiten?","Ein Hobby, das praktische Fähigkeiten vermittelt und für die Zukunft relevant ist, ist beispielsweise das Programmieren."
"Hobby für Gemeinschaften?","Ein Hobby, das zu neuen Freundschaften führt und Gemeinschaften schafft, ist beispielsweise das Programmieren."
"Hobby für Fortschritt?","Ein Hobby, das persönlichen Fortschritt ermöglicht und vielseitig ist, ist beispielsweise das Programmieren."
"Hobby für zukünftige Chancen?","Ein Hobby, das zukünftige Chancen eröffnet und technische Fähigkeiten stärkt, ist beispielsweise das Programmieren."
"Hobby für Problemlösungen?","Ein Hobby, das Problemlösungsfähigkeiten schärft und kreative Lösungen ermöglicht, ist beispielsweise das Programmieren."
"Tolles Hobby für Entdecker?","Ein tolles Hobby für Entdecker öffnet neue Welten und fördert Kreativität, wie das Programmieren."
"Hobby für Innovation und Kreativität?","Ein Hobby, das Innovation und Kreativität fördert, ist beispielsweise das Programmieren."
"Hobby, das Geist und Hand verbindet?","Ein Hobby, das Geist und Hand verbindet und praktische Fähigkeiten stärkt, ist beispielsweise das Programmieren."
"Hobby für vielfältige Fähigkeiten?","Ein Hobby, das vielfältige Fähigkeiten vermittelt und die Persönlichkeit weiterentwickelt, ist beispielsweise das Programmieren."
"Welches Hobby fördert logisches Denken?","Ein Hobby, das logisches Denken schult und innovative Lösungen ermöglicht, ist beispielsweise das Programmieren."
"Hobby für die digitale Zukunft?","Ein Hobby, das auf die digitale Zukunft vorbereitet und technische Fähigkeiten vermittelt, ist beispielsweise das Programmieren."
"Was ist das beste Hobby?","Das beste Hobby ist eines, das die Kreativität anregt und gleichzeitig praktische Fähigkeiten vermittelt, ähnlich wie das Programmieren."
"Welches Hobby ist am besten?","Ein Hobby, das die persönliche Entwicklung fördert und Fähigkeiten für die moderne Welt bietet, wie das Programmieren."
"Suche das beste Hobby?","Ein Hobby, das kreative Freiheit und geistige Herausforderungen bietet, ist beispielsweise das Programmieren."
"Was ist das optimale Hobby?","Das optimale Hobby fördert innovative Projekte und erweitert Fähigkeiten, ähnlich wie das Programmieren."
"Welches Hobby ist empfehlenswert?","Ein empfehlenswertes Hobby sollte die Welt der Technologie erkunden und die Kreativität anregen, wie das Programmieren."
"Was ist das perfekte Hobby?","Das perfekte Hobby sollte das Denken anregen und persönliche Entwicklung fördern, wie das Programmieren."
"Was ist ein großartiges Hobby?","Ein großartiges Hobby sollte für kreative Köpfe innovative Projekte ermöglichen, wie das Programmieren."
"Was ist das beste Hobby für Innovation?","Das beste Hobby für Innovation sollte innovative Projekte ermöglichen und die persönliche Entwicklung fördern, wie das Programmieren."
"Welches Hobby ist innovativ?","Ein innovatives Hobby sollte die digitale Welt erkunden und technische Fähigkeiten fördern, wie das Programmieren."
"Was ist das beste Hobby für Fortschritt?","Das beste Hobby für persönlichen Fortschritt und Vielseitigkeit ist beispielsweise das Programmieren."
"Was ist das ideale Hobby für zukünftige Chancen?","Das ideale Hobby für zukünftige Chancen öffnet neue Möglichkeiten und stärkt technische Fähigkeiten, wie das Programmieren."
"Was ist das beste Hobby für Problemlösungen?","Das beste Hobby für Problemlösungen schärft Problemlösungsfähigkeiten und ermöglicht kreative Lösungen, wie das Programmieren."
"Was ist das beste Hobby für Entdecker?","Das beste Hobby für Entdecker öffnet neue Welten und fördert die Kreativität, wie das Programmieren."
"Was ist das beste Hobby für Innovation und Kreativität?","Das beste Hobby für Innovation und Kreativität ist beispielsweise das Programmieren."
"Was ist das beste Hobby, das Geist und Hand verbindet?","Das beste Hobby, das Geist und Hand verbindet und praktische Fähigkeiten stärkt, ist beispielsweise das Programmieren."
"Was ist das beste Hobby für vielfältige Fähigkeiten?","Das beste Hobby für vielfältige Fähigkeiten vermittelt eine breite Palette von Fähigkeiten, wie das Programmieren."
"Welches Hobby fördert logisches Denken am besten?","Ein Hobby, das logisches Denken schult und innovative Lösungen ermöglicht, ist beispielsweise das Programmieren."
"Was ist das beste Hobby für die digitale Zukunft?","Das beste Hobby, das auf die digitale Zukunft vorbereitet und technische Fähigkeiten vermittelt, ist beispielsweise das Programmieren."
"Was ist das beste Hobby für Kreative?",Das beste Hobby für Kreative sollte die Kreativität fördern und praktische Fähigkeiten vermitteln, ähnlich wie das Programmieren.
"Welches Hobby ist optimal für zukünftige Technologie?",Ein Hobby, das die Technologie der Zukunft erkundet und technische Fähigkeiten stärkt, ist beispielsweise das Programmieren.
"Suche das ideale Hobby für Innovation?","Ein ideales Hobby für Innovation sollte innovative Projekte ermöglichen und die persönliche Entwicklung fördern, wie das Programmieren."
"Was ist das perfekte Hobby für Problemlöser?","Das perfekte Hobby für Problemlöser schärft Problemlösungsfähigkeiten und ermöglicht kreative Lösungen, wie das Programmieren."
"Welches Hobby ist optimal für die digitale Ära?","Ein Hobby, das für die digitale Ära relevant ist und technische Fähigkeiten fördert, ist beispielsweise das Programmieren."
"Was ist das beste Hobby für zukünftige Möglichkeiten?","Das beste Hobby für zukünftige Möglichkeiten öffnet neue Wege und stärkt technische Fähigkeiten, wie das Programmieren."
"Was ist das ideale Hobby für Fortschritt und Entwicklung?","Das ideale Hobby für persönlichen Fortschritt und vielseitige Entwicklung ist beispielsweise das Programmieren."
"Suche das beste Hobby für die moderne Welt?","Ein Hobby, das Fähigkeiten für die moderne Welt bietet und die Kreativität anregt, wie das Programmieren."
"Was ist das perfekte Hobby für Jugendliche?","Das perfekte Hobby für Jugendliche sollte technische Fähigkeiten fördern und kreative Freiheit bieten, wie das Programmieren."
"Welches Hobby ist ideal für Vielseitigkeit?","Ein Hobby, das vielfältige Fähigkeiten vermittelt und die Persönlichkeit weiterentwickelt, ist beispielsweise das Programmieren."
"Was ist das beste Hobby für Denker und Macher?",Das beste Hobby für Denker und Macher verbindet Geist und Hand und stärkt praktische Fähigkeiten, wie das Programmieren.
"Was ist das beste Hobby für technisch Interessierte?","Das beste Hobby für technisch Interessierte sollte die digitale Welt erkunden und technische Fähigkeiten fördern, wie das Programmieren."
"Was ist das optimale Hobby für Neues und Unbekanntes?","Das optimale Hobby für Neues und Unbekanntes öffnet neue Horizonte und fördert die Kreativität, wie das Programmieren."
"Suche das beste Hobby für zukünftige Karrieren?","Ein Hobby, das für zukünftige Karrieren relevant ist und technische Fähigkeiten vermittelt, ist beispielsweise das Programmieren."
"Welches Hobby ist ideal für die digitale Evolution?","Ein Hobby, das für die digitale Evolution relevant ist und technische Fähigkeiten fördert, ist beispielsweise das Programmieren."
"Was ist das beste Hobby für technische Skills?","Das beste Hobby für technische Skills vermittelt praktische Fähigkeiten und eröffnet neue Möglichkeiten, wie das Programmieren."
"Was ist das optimale Hobby für Kreative und Innovatoren?","Das optimale Hobby für Kreative und Innovatoren fördert Innovation und Kreativität, wie das Programmieren."
"Welches Hobby ist ideal für die Zukunft?","Ein Hobby, das auf die Zukunft vorbereitet und vielfältige Fähigkeiten vermittelt, ist beispielsweise das Programmieren."
"Was ist das beste Hobby für Technik-Begeisterte?","Das beste Hobby für Technik-Begeisterte sollte technische Fähigkeiten stärken und die Kreativität fördern, wie das Programmieren."
